user_name,user_location,user_description,user_created,user_followers,user_friends,user_favourites,user_verified,date,text,hashtags,source,is_retweet,sentiments,clean_text
ʟᴜʟᴜ ʟᴇ ᴍᴇᴡ ᕕ( ͡ ͡°‸↼‶)ᕗ,This Planet We SHARE ッ,I Stand For Truth ▪︎ Justice ▪︎ Equality ▪︎ Humanity DON’T U? ▪︎ VisualNinja ▪︎ HateFightr ▪︎ KnowledgeHuntr ▪︎ PragmaticEmpath ▪︎ CogSec ▪︎ OpWombat 👀,2013-08-16 11:45:27,24437,4396,131393,False,2020-07-28 06:22:53,"Also— share this type of info. 

Boost legit info that will help others. 

Re: #COVID19 Boost healthcare pros too… https://t.co/s0bfQtvq42",['COVID19'],Twitter for iPhone,False,positive,"['also', 'share', 'type', 'info', 'boost', 'legit', 'info', 'help', 'others', 'covid', 'boost', 'healthcare', 'pros']"
HQ Therapy,"Dalston & Haggerston, Hackney, London","HQ therapy rooms provide a warm, inviting and supportive space for both client and therapists. Our spaces are part of an interactive professional community",2016-05-13 07:09:01,643,1075,2712,False,2020-08-17 07:18:21,"Stay strong. Stay safe. Spread love &amp; kindness wherever you are 🥰

#cats #felinefriends #Wellbeing #Coronavirus… https://t.co/YUJA0UjRn7","['cats', 'felinefriends', 'Wellbeing', 'Coronavirus']",Twitter Web App,False,positive,"['stay', 'strong', 'stay', 'safe', 'spread', 'love', 'amp', 'kindness', 'wherever', 'cat', 'felinefriends', 'wellbeing', 'coronavirus']"
Katherine Read,,Having 3 years of working experience in organizing various scientific events and conferences worldwide.,2019-03-03 17:14:04,26,195,1,False,2020-08-13 07:34:18,"Stay safe from COVID-19
.
.
 #covid_19 #covid19 #covid19indonesia #covid19news #covid #covıd19 #covidart… https://t.co/PSR7u7rAOi","['covid_19', 'covid19', 'covid19indonesia', 'covid19news', 'covid', 'covıd19', 'covidart']",Instagram,False,positive,"['stay', 'safe', 'covid', 'covid', 'covid', 'covidindonesia', 'covidnews', 'covid', 'covd', 'covidart']"
mahak gulati,,Banker,2016-01-23 15:54:40,6,11,20,False,2020-07-25 07:34:30,"Wishing for the speedy recovery of our cm #shivrajrajsingh .
Hope u have now  understood corona virus is not just a… https://t.co/P5GVG4AzZQ",['shivrajrajsingh'],Twitter for Android,False,positive,"['wish', 'speedy', 'recovery', 'cm', 'shivrajrajsingh', 'hope', 'u', 'understand', 'corona', 'virus']"
Nick Athans,"Melbourne, Victoria",,2020-06-16 11:55:43,6,46,232,False,2020-08-16 02:04:31,Coming up to spring and summer....Will it be legal to wear skirts and g-strings?.....Gotta put a mask on that arse!… https://t.co/uuHu9cw57B,,Twitter for iPad,False,positive,"['come', 'spring', 'summer', 'legal', 'wear', 'skirt', 'gstrings', 'gotta', 'put', 'mask', 'arse']"
HIV Good Stories,South Africa,Multi-Award-Winning Campaign | Changing the way people view & experience #HIV #AIDS to create HIV-friendly communities | Highlight HIV-possibilities,2011-12-11 16:01:43,6929,4864,830,False,2020-08-17 05:36:09,"#TheGoodStoriesCover:

“Protect me as I do you” — #GoodStoriesSA Team.

#Lockdown #Level2 #CoronaVirus #Covid19 https://t.co/Gxk9QHHn78","['TheGoodStoriesCover', 'GoodStoriesSA', 'Lockdown', 'Level2', 'CoronaVirus', 'Covid19']",Twitter for iPhone,False,positive,"['thegoodstoriescover', 'protect', 'goodstoriessa', 'team', 'lockdown', 'level', 'coronavirus', 'covid']"
Crawford Kilian,"North Vancouver, BC","Retired college teacher & persistent writer (journalism, science fiction, fantasy, regional history, education). Also blogging on too many subjects.",2009-01-15 22:39:28,9304,3030,1625,False,2020-07-31 17:09:52,@iwelsh Vietnamese are ticked off too. Described it as terminal kidney disease with a positive #COVID19 test as a kind of coincidence.,['COVID19'],Twitter Web App,False,positive,"['iwelsh', 'vietnamese', 'tick', 'describe', 'terminal', 'kidney', 'disease', 'positive', 'covid', 'test', 'kind', 'coincidence']"
Tyler,"Washington, USA",✨🎨•💍🧔🏽@sdoublegmrfox | NB/GQ | Views are my own | They/Them | PS4 |🏳️‍🌈🔗🐶 Likes ~18+|Commissions Open #Resist #VoteBlue #BLM #TransLivesMatter,2011-10-04 21:11:31,4107,5001,62992,False,2020-08-10 15:10:36,"Anti-Masker               Anti-Vaxxer
                          
                           🤝
       Not welcome in… https://t.co/GHKJwVFR8P",,Twitter for iPhone,False,positive,"['antimasker', 'antivaxxer', 'welcome']"
AOI Office Furniture,"Roselle, IL","AOI has the unique ability to offer creative solutions by providing a blend of New, Recycled and ReManufactured office furniture to the IL. & WI. area.",2010-02-02 21:14:04,2660,2301,667,False,2020-07-31 17:01:20,Check out our most recent blog article on how you can prepare for a safe return to the office:… https://t.co/5xo1wgA5OB,,SocialPilot.co,False,positive,"['check', 'recent', 'blog', 'article', 'prepare', 'safe', 'return', 'office']"
Margo 👀👂,Canada,"Mom to two cool dudes, politico, philosopher, financial advisor NO LISTS #HCLDR CANADIAN♡",2009-09-17 19:02:29,3219,4994,20428,False,2020-08-18 16:23:49,@ZevShalev #wuhanparty bet the party goers are actually #Uighurs #Xi shipped out of concentration camps to act/pret… https://t.co/cIqL4CgQWE,"['wuhanparty', 'Uighurs', 'Xi']",Twitter for Android,False,positive,"['zevshalev', 'wuhanparty', 'bet', 'party', 'goers', 'actually', 'uighurs', 'xi', 'ship', 'concentration', 'camp', 'actpret']"
Dont Panic!,,Some news,2020-02-25 06:58:07,3,0,0,False,2020-07-27 06:47:01,Vietnam postponed the regional security forum of the Association of Southeast Asian Nations (ASEAN) and the annual… https://t.co/TQBY5FM6nW,,Twitter Web App,False,positive,"['vietnam', 'postpone', 'regional', 'security', 'forum', 'association', 'southeast', 'asian', 'nations', 'asean', 'annual']"
Michael McDermott,"Sahuarita, AZ","Internationally renown Chef, consultant, spokesperson, Product developer, Founder of The Kids Cooking Network @ https://t.co/eYtO98msDi",2009-03-14 17:45:10,1558,2321,1209,False,2020-08-30 02:18:42,"CHEF MICHAEL’S FOOD HACKS on WRLR 98.3 FM with Kim Olsen Tubek &amp; Eddie Johnson!  FUN &amp; FOOD for ALL!

#COVID19… https://t.co/h57B8S6c3r",['COVID19'],LinkedIn,False,positive,"['chef', 'michaels', 'food', 'hack', 'wrlr', 'fm', 'kim', 'olsen', 'tubek', 'amp', 'eddie', 'johnson', 'fun', 'amp', 'food', 'covid']"
sky waters👄,In your dreams ,"To wish you were someone else is a waste to the person you are. #mombreezy follows me☺ #teambreezy #ifb #1DDDrive  I♥ fifty shades of grey,darker,freed. 💋💋",2011-05-04 12:43:39,17513,18040,66743,False,2020-08-10 15:21:12,@KamalaHarris @GovKemp @KeishaBottoms  this student should have never gotten suspended in the first place. She was… https://t.co/nopKK03E6c,,Twitter for Android,False,positive,"['kamalaharris', 'govkemp', 'keishabottoms', 'student', 'never', 'get', 'suspend', 'first', 'place']"
"Gavi, the Vaccine Alliance","Geneva, Switzerland","Gavi, the Vaccine Alliance, helps vaccinate half the world’s children against deadly and debilitating diseases. #VaccinesWork",2009-12-16 14:32:10,123522,1322,5694,True,2020-08-10 15:30:00,How will wearing a mask protect me - and those around me -from #COVID19? Here’s why it’s so vital to #WearAMask: https://t.co/Xprq3jld5G,"['COVID19', 'WearAMask']",Twitter Media Studio,False,positive,"['wear', 'mask', 'protect', 'around', 'covid', 'heres', 'vital', 'wearamask']"
Breaking News 🇸🇴,England,"News, Stories, Sport and Entertainment From Around The Globe. Indigenous Brit.
RTs ≠ endorsements. Journalist #NUJ member W026487 Musician Songwriter 🎸🎹 #FB",2011-11-25 14:01:45,45234,39852,782,False,2020-08-02 21:29:05,"#COVID19 Let's be clear! The is a continuous wave, masks lockdowns meetings businesses, mixing with different age g… https://t.co/xluk2kr0Cp",['COVID19'],Twitter for Android,False,positive,"['covid', 'let', 'clear', 'continuous', 'wave', 'mask', 'lockdowns', 'meet', 'businesses', 'mix', 'different', 'age', 'g']"
Praying Works,,"The online and mobile prayer platform with all the tools you need to pray, intercede and change the world",2016-06-04 14:47:57,165,409,588,False,2020-07-27 03:00:03,"Start your prayer testimony network on https://t.co/nPFbcbQFN7
#worship #grace #godlovesyou #jesuslovesyou… https://t.co/SoxJloNKPh","['worship', 'grace', 'godlovesyou', 'jesuslovesyou']",Zoho Social,False,positive,"['start', 'prayer', 'testimony', 'network', 'worship', 'grace', 'godlovesyou', 'jesuslovesyou']"
Interbrand,Global,We are a global brand consultancy pioneering the future of brand building.,2009-05-13 18:11:55,58361,4264,8495,False,2020-07-29 16:29:50,".@emirates has become the first airline to offer free #COVID19 insurance, @Walmart’s e-commerce business grew 74% d… https://t.co/7bncdxbuIP",['COVID19'],Twitter Web App,False,positive,"['emirates', 'become', 'first', 'airline', 'offer', 'free', 'covid', 'insurance', 'walmarts', 'ecommerce', 'business', 'grow']"
British Geriatrics Society,UK,The British Geriatrics Society is a multi-disciplinary professional membership association promoting better health & care for older people. RTs not endorsement.,2012-05-04 15:43:01,24101,5246,9961,False,2020-08-08 13:22:09,'The Face Shield Clouded My Vision' via @minjikwak2 @UTHealth #PPE #COVID19 #faceshield https://t.co/hhrZklyAfP https://t.co/zzbrSTfdjq,"['PPE', 'COVID19', 'faceshield']",Twitter Web App,False,positive,"['face', 'shield', 'cloud', 'vision', 'via', 'minjikwak', 'uthealth', 'ppe', 'covid', 'faceshield']"
🔊🍷😷Halli Casser-Jayne Podcast🔊🍷😷,"Florida, USA","Halli hosts THE HALLI CASSER-JAYNE PODCAST Democracy dies one lie at a time. Defeat Trump, save us all! https://t.co/XZTWJ2aBi7",2008-08-19 00:45:44,26652,20443,24259,False,2020-08-29 23:13:26,All You #MAGAs who don't think that covid-19 is real because Trump doesn't wear a mask and told you a miracle will… https://t.co/L7RnDvCfkL,['MAGAs'],Twitter for Android,False,positive,"['magas', 'think', 'covid', 'real', 'trump', 'wear', 'mask', 'tell', 'miracle']"
"""Fantacy Tv"" Channel ( A Mirror of News Agency )","Agartala, Tripura, India (UDP)","owner/Editor In Chief Mr. Banibrata Datta (Journalist) : NEWS PRESS-MEDIA NETWORK IN TRIPURA, INDIA {A Mirror of Transparency News & Views} #Creativity#Matabari",2015-08-20 17:28:23,49,392,617,False,2020-08-30 02:31:45,The Africa Centres for Disease Control and Prevention (Africa CDC) on Saturday said that the number of positive… https://t.co/PvBHhugOTt,,Twitter for Android,False,positive,"['africa', 'centre', 'disease', 'control', 'prevention', 'africa', 'cdc', 'saturday', 'say', 'number', 'positive']"
HappyLight,Jerusalem,My Twitter brand is ineffable שִׂמְחָ֣ה לָ֭אִישׁ בְּמַעֲנֵה־פִ֑יו וְדָבָ֖ר בְּעִתּ֣וֹ מַה־טּֽוֹב,2012-01-31 12:44:07,571,282,30252,False,2020-07-27 05:37:57,"I'm calling it now. The big fashion surprise this winter is that #COVID19 is gone from the earth, but we all wear m… https://t.co/dhvL0ajbIg",['COVID19'],Twitter Web App,False,positive,"['call', 'big', 'fashion', 'surprise', 'winter', 'covid', 'go', 'earth', 'wear']"
The Way I See It,,"Do no Harm to Self and Others

Tump will win 2020 because Election Fraud and Voter Suppression.  Just thought you should be aware.",2020-06-28 16:42:32,20,103,1732,False,2020-08-06 15:56:16,@goldengateblond But who gets one?   Are they free and available to all?   And if you don't believe in #COVID19 the… https://t.co/pTtwNcklLU,['COVID19'],Twitter Web App,False,positive,"['goldengateblond', 'get', 'one', 'free', 'available', 'believe', 'covid']"
Mr MHY💀,,"Army Public School Saddar ,Karachi Pakistan",2017-10-11 18:16:19,2,6,29,False,2020-08-13 09:25:55,"What the hell is this ? 
Like I got As in last year and now I got Bs And Cs in this year 
Yaar like ajeeb , like hu… https://t.co/cCDbHz4OTE",,Twitter for Android,False,positive,"['hell', 'like', 'get', 'last', 'year', 'get', 'bs', 'cs', 'year', 'yaar', 'like', 'ajeeb', 'like', 'hu']"
Miss Amy,"Los Angeles, CA",Program Leader in the LA Metro area.,2020-07-14 15:37:11,2,9,1,False,2020-07-31 19:09:43,#Congress needs to protect every child’s fundamental right to a quality education. Our nation needs you to pass the… https://t.co/DUXUVW7oLR,['Congress'],Twitter for iPhone,False,positive,"['congress', 'need', 'protect', 'every', 'childs', 'fundamental', 'right', 'quality', 'education', 'nation', 'need', 'pass']"
Aunty Shawty,,"Vibes🍌🍌
I follow back",2020-07-31 06:37:59,170,162,50,False,2020-07-31 18:11:37,"Be a nice person. Hope you had a great day. 
I follow back.. #Arewatwitter #mummycalmdown #brownskingirl… https://t.co/XsvKlIRdcc","['Arewatwitter', 'mummycalmdown', 'brownskingirl']",Twitter for Android,False,positive,"['nice', 'person', 'hope', 'great', 'day', 'follow', 'back', 'arewatwitter', 'mummycalmdown', 'brownskingirl']"
Hedge of Hedgies,"Chicago, IL","Let's talk Hedge Funds and Alternative Investment Strategies!
#alts",2014-08-24 19:18:55,3334,4202,261,False,2020-07-25 04:50:03,Aqualung Therapeutics Corporation was awarded an NIH FASTRACK AWARD in 2019 with Phase I to support mid-stage ident… https://t.co/o3QRwmGJ7P,,Buffer,False,positive,"['aqualung', 'therapeutics', 'corporation', 'award', 'nih', 'fastrack', 'award', 'phase', 'support', 'midstage', 'ident']"
Shankar Prasad,New Delhi,"#BigDataEngineer, #DataScience, #AI, #MachineLearning, #Python",2010-05-07 16:38:52,45,406,405,False,2020-08-14 02:13:24,"#Bot result - #Covid19 Latest Updates - #Bengaluru Urban

                Positive: 81733 | Active: 33148 | Recover… https://t.co/pYlfyToFMe","['Bot', 'Covid19', 'Bengaluru']",shankar_live_bot,False,positive,"['bot', 'result', 'covid', 'latest', 'update', 'bengaluru', 'urban', 'positive', 'active', 'recover']"
NANCE,anywhere u want me 2 b.,"love my family, Lakers, Yankees & AL football",2012-01-07 03:32:27,376,498,124,False,2020-08-06 15:46:35,"@Mastermind7864 He looks off camera looking for KellyAnn, he's like KellyAnn were is my homework see teacher i got it #COVID19 #AxiosOnHBO","['COVID19', 'AxiosOnHBO']",Twitter for Android,False,positive,"['mastermind', 'look', 'camera', 'look', 'kellyann', 'like', 'kellyann', 'homework', 'see', 'teacher', 'get', 'covid', 'axiosonhbo']"
Gretchen Stangier,"Portland, OR","I provide individualized practical financial advice and planning solutions. Gretchen Stangier, Inc. is a registered investment adviser in OR, WA, and TX.",2012-03-16 19:23:53,440,1082,11,False,2020-07-25 01:35:02,The stock market took a downturn in response to COVID-19. Let’s review some important terms. #StockMarket #Stocks… https://t.co/6rNemdH4NK,"['StockMarket', 'Stocks']",Hootsuite Inc.,False,positive,"['stock', 'market', 'take', 'downturn', 'response', 'covid', 'let', 'review', 'important', 'term', 'stockmarket', 'stock']"
Subhomoy,,"Commentator on Indian biz & GOI economic policies. Author of ""India's Coal Story"". RT just what I fancy; Consulting Editor @bsindia, Sr Fellow @RIS_NewDelhi",2009-09-29 16:17:32,2632,918,1671,False,2020-08-09 07:30:16,"For urbanites who sauntered through these spaces just as a relaxation, this wont do. But its #COVID19 times  ""Let’s… https://t.co/c3DY1dJLN3",['COVID19'],Twitter Web App,False,positive,"['urbanites', 'saunter', 'space', 'relaxation', 'wont', 'covid', 'time', 'let']"
Shankar Prasad,New Delhi,"#BigDataEngineer, #DataScience, #AI, #MachineLearning, #Python",2010-05-07 16:38:52,45,406,405,False,2020-08-14 02:13:25,"#Bot result - #Covid19 Latest Updates - #Nagpur

                Positive: 11151 | Active: 6727 | Recovered: 4116 |… https://t.co/0uX4hzsu4j","['Bot', 'Covid19', 'Nagpur']",shankar_live_bot,False,positive,"['bot', 'result', 'covid', 'latest', 'update', 'nagpur', 'positive', 'active', 'recover']"
Chels Chavie,,I like the way you move it,2020-08-17 04:00:05,3,3,12,False,2020-08-17 04:32:01,Telcos deserve to be praised for all their hardworks even in these times. They're making sure to provide better exp… https://t.co/fnC9MNDAcz,,Twitter for Android,False,positive,"['telcos', 'deserve', 'praise', 'hardworks', 'even', 'time', 'make', 'sure', 'provide', 'better', 'exp']"
IOL News,South Africa,Independent Online | Connecting South Africans | Driving Change | Telling Stories That Matter | News for the Heart of South Africa,2007-01-17 12:50:26,441567,11566,2051,True,2020-08-22 08:47:26,@serenawilliams believes the withdrawal of some of the world's top tennis players from this year's #USOpen amid the… https://t.co/rA06havKUf,['USOpen'],TweetDeck,False,positive,"['serenawilliams', 'believe', 'withdrawal', 'world', 'top', 'tennis', 'players', 'year', 'usopen', 'amid']"
Paul Mueller,"Binghamton, NY","Communications Professional, Animal Advocate, Dad to #Asiatherescuedog, Son, Survivor, 12 Steps, Problem Solver. Opinions are my own.",2009-09-02 17:36:44,5390,784,12402,False,2020-07-31 18:23:37,RIP #Buddy - the first dog to test positive for #COVID19 - has died.   His humans shared their story with @NatGeo a… https://t.co/ZlUjnS4xlB,"['Buddy', 'COVID19']",Twitter for iPhone,False,positive,"['rip', 'buddy', 'first', 'dog', 'test', 'positive', 'covid', 'die', 'humans', 'share', 'story', 'natgeo']"
NBS Television,Uganda,"Always consistent, Always informative, Always entertaining. Make us part of your everyday life. Follow every story via #NBSUpdates #UgVotes2021",2011-07-29 13:50:11,623797,170,5450,True,2020-08-11 09:01:06,Minister Nakiwala Kiyingi: Our youth face sexual reproduction health challenges that continue to impinge on their d… https://t.co/QYDfczNZlF,,TweetDeck,False,positive,"['minister', 'nakiwala', 'kiyingi', 'youth', 'face', 'sexual', 'reproduction', 'health', 'challenge', 'continue', 'impinge']"
Eisen,"Singapore, Singapura, Temasek","Singapore-based historian. Author of Jalan Singapura: 700 Years of Movement in Singapore, in stores now. Passions include history, transport, and urban studies.",2007-04-01 17:07:22,3614,1089,5124,False,2020-07-27 05:19:17,"Experts list reasons for 2020's record number of dengue infections, including:

1. Fewer people immune to a dengue… https://t.co/IwSwOTqNdY",,Twitter Web App,False,positive,"['experts', 'list', 'reason', 'record', 'number', 'dengue', 'infections', 'include', 'fewer', 'people', 'immune', 'dengue']"
Covid-19 Bot,,Tweeting stats about Covid-19. A @joe_scotto product.,2020-03-11 20:27:58,38,1,2,False,2020-08-17 07:37:02,"Cases: 21,684,349 (+10,219) 
Deaths: 775,489 (+214) 
Recovered: 13,678,700 (+82) 
Active Cases: 8,005,649 (36.92%)… https://t.co/2rW6lDxHus",,Covid-19 Bot,False,positive,"['case', 'deaths', 'recover', 'active', 'case']"
Medina jean-francois,,WEU Manager Data Sourcing & Business Dev.,2018-09-19 12:08:21,64,242,188,False,2020-08-08 10:30:02,Download the latest Omdia Location Platform Index to better understand the role that location technology can play i… https://t.co/0kPHzgb0z7,,LinkedIn,False,positive,"['download', 'latest', 'omdia', 'location', 'platform', 'index', 'better', 'understand', 'role', 'location', 'technology', 'play']"
Ja9,,"GO 🇨🇦Canada🇨🇦
If you and I are beside each other on the treadmills at the gym, then the answer is yes,
we are racing. 
Just kiddin' I hate the gym.😝",2013-06-18 18:59:23,82,277,7799,False,2020-08-09 07:03:10,"@BrandiGlanville Oh @ShannonBeador your holistic weirdness isn't going to help you against #COVID19 . 
Please educa… https://t.co/nxmqHcrPkq",['COVID19'],Twitter for Android,False,positive,"['brandiglanville', 'oh', 'shannonbeador', 'holistic', 'weirdness', 'go', 'help', 'covid', 'please', 'educa']"
Janine Dietler,,,2016-06-06 18:42:23,11,30,18,False,2020-07-25 08:29:26,"In the face of new challenges in the #COVID19 era, we’re developing pioneering solutions. @Ferland_Martine shares w… https://t.co/sL7zrTNVCt",['COVID19'],Dynamic Signal,False,positive,"['face', 'new', 'challenge', 'covid', 'era', 'develop', 'pioneer', 'solutions', 'ferland', 'martine', 'share', 'w']"
Alex Macheras,"Usually at 38,000ft / London",Aviation Analyst. Frequent Flyer. Broadcasting #Aviation News @LBC @SkyNews @BBC @AlJazeera @GMB. Gulf-Times Columnist. Channel 4’s #WorldsMostLuxuriousAirline,2010-09-17 16:10:41,43420,4276,7810,True,2020-07-26 07:53:12,"When @grantshapps announced a quarantine-free list as “great news for holidaymakers!” just 3 weeks ago, he decided… https://t.co/wTSbaAHfUd",,Twitter for iPhone,False,positive,"['grantshapps', 'announce', 'quarantinefree', 'list', 'great', 'news', 'holidaymakers', 'weeks', 'ago', 'decide']"
Lynne with an E 🌸,United States,,2017-02-21 15:35:06,57,84,9967,False,2020-07-25 03:26:34,I kinda have to laugh at a few people I know. First they yell about Disney needing to be closed and they don’t feel… https://t.co/kClJCeiiUc,,Twitter for iPhone,False,positive,"['kinda', 'laugh', 'people', 'know', 'first', 'yell', 'disney', 'need', 'close', 'dont', 'feel']"
John Walker,North Wales UK,Kew-trained #gardening & #environment #writer #author #blogger #micropublisher enjoying #peatfree growing. Buy my #glyphosate-free book WEEDS from my website.,2010-11-02 21:31:51,8625,8289,12047,False,2020-08-02 19:21:31,"Wake up Brits, empathy alert ahead: time to remember that we're not all the same homogenized mass. #COVID19… https://t.co/we2XvVFXmn",['COVID19'],Twitter Web App,False,positive,"['wake', 'brits', 'empathy', 'alert', 'ahead', 'time', 'remember', 'homogenize', 'mass', 'covid']"
Mr. More,,my mind,2020-03-30 01:54:02,2,53,6,False,2020-07-28 05:03:14,"This video is dedicated for all the pieces of SHT who like to give you ""the look"" when your without a mask.

Stop w… https://t.co/PEcJOXldkB",,Twitter for Android,False,positive,"['video', 'dedicate', 'piece', 'sht', 'like', 'give', 'look', 'without', 'mask', 'stop', 'w']"
Demonforce🌊🌊🌊#FBR,Melbourne,#TheResistance #BlueWave 🌊🌊🌊🌊🌊 #FBR Avid MFC and MVFC supporter,2009-04-26 09:37:18,3490,4972,13058,False,2020-07-25 00:34:30,@fnfgyms Let’s hope you do not see #EveLimberiou as a great brand ambassador after her appalling #Covid19 stunt in Victoria #Disgrace,"['EveLimberiou', 'Covid19', 'Disgrace']",Twitter for iPad,False,positive,"['fnfgyms', 'let', 'hope', 'see', 'evelimberiou', 'great', 'brand', 'ambassador', 'appal', 'covid', 'stunt', 'victoria', 'disgrace']"
Malte Humpert,,Founder @arcticinstitute | Arctic + shipping oil gas climate change security | Freelance Map Maker + Journalist @highnorthnews | Formerly @the_IDB @BIDenergia,2011-07-19 21:22:45,999,318,2459,False,2020-08-04 04:30:52,"And this is why schools can not reopen! 

""Young children not only transmit SARS-CoV-2 efficiently, but may be majo… https://t.co/NCqja65r5x",,Twitter for iPhone,False,positive,"['school', 'reopen', 'young', 'children', 'transmit', 'sarscov', 'efficiently', 'may', 'majo']"
Dipanshu Kabra,"Bilaspur, India","#IPS officer, IG Bilaspur #Chhattisgarh Police
My FGD: #Fitness #Gardening #Dogs
interested in Politics International Affairs and philanthropy.",2016-12-22 12:13:17,49103,2943,31434,True,2020-08-09 09:04:41,"The News of Honorable Home Minister @AmitShah, being tested negative for #COVID19 is incorrect. 

No fresh test has… https://t.co/22ZkcsVZXr",['COVID19'],Twitter for Android,False,positive,"['news', 'honorable', 'home', 'minister', 'amitshah', 'test', 'negative', 'covid', 'incorrect', 'fresh', 'test']"
Laurie Charest,,"Up North 'Maine'iac - Proud Independent -
Lover of ALL animals.
Except snakes. I do not love snakes. In human form or otherwise.😜",2018-04-06 02:14:40,81,46,19553,False,2020-07-25 05:29:51,Hey @DavidMalpassWBG @KGeorgieva no country should have to choose between protecting their citizens from #COVID19 a… https://t.co/Gwgesj70dF,['COVID19'],Global Citizen Mobile App,False,positive,"['hey', 'davidmalpasswbg', 'kgeorgieva', 'country', 'choose', 'protect', 'citizens', 'covid']"
RadioNLNews,Kamloops,"B.C.'s hardest working newsroom. Serving #Kamloops and area with breaking local news for 50 years. 
☎️: 250-374-1610 ✉️: nlnews@radionl.com",2010-07-27 16:17:02,7120,2135,193,False,2020-08-14 03:10:00,The @wctlive is praising 'fantastic' community submissions from the #Kamloops community as it adapts to the… https://t.co/jAwx97Xz23,['Kamloops'],TweetDeck,False,positive,"['wctlive', 'praise', 'fantastic', 'community', 'submissions', 'kamloops', 'community', 'adapt']"
CBZ Holdings,"Harare, Zimbabwe","This is the official Twitter account for CBZ Holdings Limited (CBZH), a diversified and listed financial services group in Zimbabwe.",2015-11-11 14:05:38,21818,627,19827,False,2020-07-25 12:10:18,"Stay safe and keep washing your hands!

#StayAtHomeAndStaySafe
#StayHomeZim
#COVID19

@263Chat 
@DailyNewsZim… https://t.co/r0iFeLZNIm","['StayAtHomeAndStaySafe', 'StayHomeZim', 'COVID19']",Twitter Web App,False,positive,"['stay', 'safe', 'keep', 'wash', 'hand', 'stayathomeandstaysafe', 'stayhomezim', 'covid', 'chat', 'dailynewszim']"
stephanie francis,,,2012-03-21 01:56:37,38,94,1403,False,2020-08-29 21:35:30,Who else is having an impossible time getting any kind of response from hosts? @Airbnb #2020sucks #airbnbsucks… https://t.co/nRJ5YPdYwi,"['2020sucks', 'airbnbsucks']",Twitter for iPhone,False,positive,"['else', 'impossible', 'time', 'get', 'kind', 'response', 'host', 'airbnb', 'suck', 'airbnbsucks']"
¡Gran Fútbol Hombre!,,Far Left..,2019-03-04 22:39:08,55,851,1251,False,2020-08-14 01:48:18,"#NowPlaying
Black Beatles [feat. Gucci Mane] [Explicit] by @RaeSremmurd on Amazon Music
#BidenHarris2020Landslide… https://t.co/iuRsYdJPJY","['NowPlaying', 'BidenHarris2020Landslide']",Twitter for Android,False,positive,"['nowplaying', 'black', 'beatles', 'feat', 'gucci', 'mane', 'explicit', 'raesremmurd', 'amazon', 'music', 'bidenharrislandslide']"
